{
  "schema_version": "1.0.0",
  "device_id": "esp32-syncfit-02",
  "session_id": "8a2d4e6f-1b3c-4d5e-9f70-a1b2c3d4e5f6",
  "timestamp": "2026-09-21T09:10:00Z",
  "modality": "GESTATIONAL",
  "day_or_week": 18,
  "biomarkers": {
    "delta_temperature_c": 0.31,
    "rmssd_hrv_ms": 34.2,
    "isometric_force_loss_pct": 9.4
  },
  "ppg_window": {
    "sample_rate_hz": 100,
    "window_size": 256,
    "samples": [690.2, 691.4, 693.0, 694.9, 695.7, 694.8, 692.6, 690.9]
  }
}
